{
  "$schema": "https://json-schema.org/draft/2020-12/schema",
  "$id": "https://forgotten-tides.com/schemas/character.schema.json",
  "title": "Character Schema",
  "description": "Schema for characters in The Forgotten Tides universe",
  "type": "object",
  "required": ["id", "type", "summary_50", "summary_200", "cross_refs", "references", "continuity"],
  "properties": {
    "id": {
      "type": "string",
      "pattern": "^char-\\d{4}$",
      "description": "Character ID in format char-####"
    },
    "schema_version": {
      "type": "string",
      "pattern": "^v?\\d+\\.\\d+\\.\\d+$",
      "description": "Schema version for this frontmatter"
    },
    "uuid": {
      "type": "string",
      "format": "uuid",
      "description": "Optional UUID for unique identification"
    },
    "type": {
      "type": "string",
      "enum": ["character"],
      "description": "Entity type"
    },
    "name": {
      "type": "string",
      "description": "Character's full name"
    },
    "aliases": {
      "type": "array",
      "items": {
        "type": "string"
      },
      "description": "Alternative names or titles"
    },
    "status": {
      "type": "string",
      "enum": ["canonical", "speculative", "deprecated"],
      "description": "Canonical status of the character"
    },
    "tags": {
      "type": "array",
      "items": {
        "type": "string"
      },
      "description": "Optional tags for grouping or filtering"
    },
    "summary_50": {
      "type": "string",
      "maxLength": 220,
      "description": "Brief summary (≤ 220 characters)"
    },
    "summary_200": {
      "type": "string",
      "maxLength": 1200,
      "description": "Detailed summary (≤ 1200 characters)"
    },
    "cross_refs": {
      "type": "object",
      "description": "Cross-references to other entities",
      "properties": {
        "characters": {
          "type": "array",
          "items": {
            "type": "string",
            "pattern": "^char-\\d{4}$"
          }
        },
        "locations": {
          "type": "array",
          "items": {
            "type": "string",
            "pattern": "^loc-\\d{4}$"
          }
        },
        "factions": {
          "type": "array",
          "items": {
            "type": "string",
            "pattern": "^fact-\\d{4}$"
          }
        },
        "mechanics": {
          "type": "array",
          "items": {
            "type": "string",
            "pattern": "^mech-\\d{4}$"
          }
        },
        "stories": {
          "type": "array",
          "items": {
            "type": "string",
            "pattern": "^story-\\d{4}$"
          }
        }
      },
      "additionalProperties": false
    },
    "references": {
      "type": "object",
      "description": "Canonical references to other entities",
      "properties": {
        "characters": {
          "type": "array",
          "items": {
            "type": "string",
            "pattern": "^char-\\d{4}$"
          }
        },
        "locations": {
          "type": "array",
          "items": {
            "type": "string",
            "pattern": "^loc-\\d{4}$"
          }
        },
        "factions": {
          "type": "array",
          "items": {
            "type": "string",
            "pattern": "^fact-\\d{4}$"
          }
        },
        "mechanics": {
          "type": "array",
          "items": {
            "type": "string",
            "pattern": "^mech-\\d{4}$"
          }
        },
        "stories": {
          "type": "array",
          "items": {
            "type": "string",
            "pattern": "^story-\\d{4}$"
          }
        }
      },
      "additionalProperties": false
    },
    "continuity": {
      "type": "object",
      "required": ["invariants", "watchlist"],
      "properties": {
        "invariants": {
          "type": "array",
          "items": {
            "type": "string"
          },
          "description": "Rules that must never be violated for this character"
        },
        "watchlist": {
          "type": "array",
          "items": {
            "type": "string"
          },
          "description": "Aspects that require special attention for continuity"
        }
      }
    },
    "metadata": {
      "type": "object",
      "properties": {
        "created": {
          "type": "string",
          "format": "date-time"
        },
        "modified": {
          "type": "string",
          "format": "date-time"
        },
        "status": {
          "type": "string",
          "enum": ["canonical", "speculative", "deprecated"]
        }
      }
    }
  },
  "additionalProperties": false
}
